"sku","name","product.type","product.attribute_set","product.has_options","product.required_options","status","visibility","price","short_description","description","tax_class_id","weight","category.path","special_price","image","small_image","thumbnail","stock.qty"
"11411","FloraBright Oral Probiotics","simple","","No","No","Enabled","Catalog,Search","29.95000","<style type=""text/css""><!--.New1211CatTop	{font-family:Helvetica,Arial,sans-serif;	font-size:15px;	color:#333;	padding-top:25px;	padding-right:15px;	padding-bottom:30px;	padding-left:15px;	line-height:17px}.New1211CatTop h1	{	background-color:transparent!","<style type=""text/css""><!--.New1211CatTop	{font-family:Helvetica,Arial,sans-serif;	font-size:15px;	color:#333;	padding-top:25px;	padding-right:15px;	padding-bottom:30px;	padding-left:15px;	line-height:17px}.New1211CatTop h1	{	background-color:transparent!important;	font-size:26px;	color:#060;	padding-bottom:3px;	border-bottom-width:2px;	border-bottom-style:dotted;	border-bottom-color:#CCC}.New1211CatTop h2 {	font-size: 20px;	margin-top: 15px;	margin-bottom: 25px;}.New1211CatTop p	{	font-family:Helvetica, Arial, sans-serif;	font-size:15px;	line-height:normal;	color:#333;	margin-bottom:25px}.New1211CatTop p a	{color:#645A5A;	font-weight:bold}.New1211CatTop p a:hover	{background-color:#333;	text-decoration:none;	color:#FFF}.NewCatHeadimg	{padding-top:25px;	padding-right:15px;	padding-bottom:5px;	padding-left:15px;	position:relative}.New1211CatTop ul	{	margin-top:20px;	margin-left:25px;	padding-left:1em;	color:#333;	list-style-type:square}.New1211CatTop ul li	{margin-bottom:6px}--></style><div class=""New1211CatTop"">  <h1>Nutri-Health <strong>FloraBright</strong></h1>  <h2><strong>Whiter Teeth, Fresh Breath, and Better Oral Health</strong>  </h2>  <p><strong>FloraBright </strong>contains an award winning combination of natural oral probiotics that work together to support and protect healthy teeth, shield against gum problems and bad breath, and gently restore your smile from dull and yellow to bright and white.</p>  <h2>How will FloraBright benefit your health?</h2>  <p>In just seconds, <strong>FloraBright</strong> goes to work to create a perfectly healthy mouth, and gives you: </p>  <ul>    <li>A beautiful, confident smile</li>    <li>Strong, healthy teeth and gums</li>    <li>Fresh, clean breath that lasts</li>    <li>Whiteness that comes naturally—not from harsh scraping or chemicals</li>  </ul>  <p>&nbsp;</p>  <h2><strong>Why choose FloraBright?</strong>  </h2>  <p>Inside your mouth, bad bacteria convert sugar and other carbohydrates to lactic acid—or &ldquo;cavity fuel&rdquo; —that also wears away at your teeth&rsquo;s delicate enamel. </p>  <p>Together, the three specialized probiotic strains in <strong>FloraBright</strong> work to beat back this cavity-creating process, and naturally protect your teeth and gums. </p>  <p>The S. rattus JH145 strain in <strong>FloraBright</strong> keeps your teeth naturally strong and healthy. In one clinical study it was shown to decrease harmful bacteria by as much as 85%.</p>  <p>The other two strains in <strong>FloraBright</strong>—S. oralis and S. uberis—create microscopic levels of hydrogen peroxide which not only inhibit the growth of bad bacteria that can harm your teeth and gums, but also help freshen your breath and keep your teeth noticeably whiter too!<br />    <br />    Enjoy a single <strong>FloraBright</strong> mint each day, and you&rsquo;ll have something no other mint, gum or mouthwash can give you…a healthy balance of oral flora, to keep you looking and feeling great, and protection for your teeth and gums all day long! <br />  <br />  <strong>FloraBright </strong>contains no harsh bleaching agents and no artificial ingredients.&nbsp;Each spearmint-vanilla flavored mint is sweetened with xylitol, to promote healthier teeth. Xylitol is a natural sugar substitute that helps prevent bacteria from sticking to your teeth.</p>  <strong>FloraBright</strong> is beneficial for both adults and children as a part of a daily oral hygiene routine and is safe for your teeth, gums, veneers, caps and even dentures.<p style=""font-size:9px"">* These statements have not been evaluated by the Food and Drug Administration. This product is not intended to diagnose, treat, cure, or prevent any disease.</p></div>","Taxable Goods","1.00","","","http://www.nutri-health.com/images/products/11411.png","","http://www.nutri-health.com/images/products/thumbs/11411.jpg","21"
"10805","Focus Force Memory & Brain Supplements","simple","","No","No","Enabled","Catalog,Search","39.95000","<p><span style=""font-family: verdana,geneva;""><span style=""font-size: small;""><strong>Focus Force&reg; Active Memory supports:<br /></strong></span></span><span style=""font-family: verdana,geneva;""><span style=""font-size: small;""><br />&bull; Healthy memo","<p><span style=""font-family: verdana,geneva;""><span style=""font-size: small;""><strong>Focus Force&reg; Active Memory supports:<br /></strong></span></span><span style=""font-family: verdana,geneva;""><span style=""font-size: small;""><br />&bull; Healthy memory as you age<br /></span></span><span style=""font-family: verdana,geneva;""><span style=""font-size: small;"">&bull; Focused concentration, and healthy brain function.<br /></span></span><span style=""font-family: verdana,geneva;""><span style=""font-size: small;""><br />This clinically based formula combines GABA, an all-natural amino acid, with antioxidants Huperzine A and Alpha-Lipoic Acid for targeted brain health support.<br /></span></span><span style=""font-family: verdana,geneva;""><span style=""font-size: small;""><br />These powerful natural ingredients help <em>promote cognitive focus and manage stress levels in the brain plus support healthy brain chemical activity</em> &ndash; all in one synergistic formula.<br /></span></span><span style=""font-family: verdana,geneva;""><span style=""font-size: small;""><br />A potent boost of vitamin D3 finishes this power-blend for overall cellular health.<br /><br />Suggested Use: Adults take 1 capsule daily on an empty stomach.<br /></span></span><span style=""font-family: verdana,geneva;""><span style=""font-size: small;""><br />30 Vegetarian Capsules</span></span></p>","Taxable Goods","1.00","","","http://www.nutri-health.com/images/products/10805.png","","http://www.nutri-health.com/images/products/thumbs/10805.jpg","2854"
"11601","Memoril Memory & Mood","simple","","No","No","Enabled","Catalog,Search","39.95000","<p class=""MsoNormal"" style=""margin: 0in 0in 10pt;""><span style=""font-size: small;""><span style=""font-family: verdana,geneva;""><b>Experience this Amazing <i>60-Minute Brain Booster that LASTS FOR HOURS</i></b><i><br /></i><br />Do you randomly forget thing","<p class=""MsoNormal"" style=""margin: 0in 0in 10pt;""><span style=""font-size: small;""><span style=""font-family: verdana,geneva;""><b>Experience this Amazing <i>60-Minute Brain Booster that LASTS FOR HOURS</i></b><i><br /></i><br />Do you randomly forget things... like the phone number that was on the tip of your tongue two seconds ago or the name of the new co-worker you were just introduced to? And how crazy is it when you misplace the tool you just had in your hand or spend an hour look for the pair of sunglasses that are sitting on top of your head?<br /><br />Thank goodness for <i><b>Memoril</b></i>!<br /><br /><i><b>Memoril</b></i> is a fast-acting brain-booster clinically proven to improve focus, memory, attention and mood. It includes three super brain nutrients and <i>starts working in less than one hour</i>. Just take a look at the superstar ingredients you&rsquo;ll find in <i><b>Memoril</b></i> and what they can do for you...<br /><br /><b>Enhance Your Ability to Focus, Remember and React</b><br /><b><br />Super Brain Booster #1 &ndash; Cereboost&trade;</b>. Our unique memory formula features a potent American ginseng extract called Cereboost. In a recent double-blind, placebo-controlled, cross-over clinical study, subjects taking 200 mg daily of Cereboost (the same amount in <i><b>Memoril</b></i>) had great results. In as little as one hour, the participants experienced... <br /><br />&bull;&nbsp;&nbsp;&nbsp; Improved ability to focus<br />&bull;&nbsp;&nbsp;&nbsp; More accurate memory recall<br />&bull;&nbsp;&nbsp;&nbsp; Faster reaction time<br /><br />The results of this study establish that Cereboost&trade; has a powerful impact on cognitive performance by enhancing both short and long term memory, attention and focus. These dramatic improvements <i>occurred in less than an hour and lasted up to six hours</i>!<br /><br /><b>Ditch Stress and Anxiety that Affect Your Alertness and Ability to Concentrate</b><br /><br /><b>Super Brain Booster #2 &ndash; Sensoril&reg;</b>. Symptoms of stress and anxiety can have a negative impact on your memory and concentration. That&rsquo;s why we added a highly potent form of ashwagandha extract called Sensoril to our formula. <br /><br />In a randomized, double-blind placebo controlled human clinical trial - the &ldquo;gold standard&rdquo; in product efficacy validation - researchers found that the ashwagandha in Sensoril <i>significantly reduced forgetfulness and inability to concentrate</i>. <br /><br />It also helps with numerous stress factors that may be interfering with your mental function. Subjects taking 250 mg. of Sensoril were able to sleep better, had a reduction in fatigue and less irritability. Additionally, they experienced fewer incidences of headache and muscle pain. <br /><br />Once you get these symptoms of stress out of the way it&rsquo;s much easier to maintain a relaxed, focused mood that helps naturally promote <i>better concentration, recall, and mental sharpness</i>.<br /><br /><b>A Nourished Brain Works Much Better!</b><br /><br /><b>Super Brain Booster #3 &ndash; Vinpocetine</b>. Increasing blood flow to the brain is essential to keeping your brain healthy and active. That&rsquo;s because your blood delivers all of the oxygen and nutrients necessary for robust brain and nerve cell functioning. But even during normal aging, blood flow to the brain may decrease by 20%.<br /><br />Research shows vinpocetine improves blood flow into the brain. This helps protect brain cells from injury which, in turn, may <i>enhance memory, focus and mental clarity</i>.<br /><br />Don&rsquo;t settle for a lifetime of forgetfulness, slow responses and dull-thinking. Sharpen your mental energy, boost you concentration and power up your recall ability. Just one dose of Memoril will kick your brain into action in 60 minutes or less... and keep it that way for the next 6 hours.<br /><br />Suggested Use:&nbsp;Take 2 capsules daily, preferably with a meal.<br /><br />60 Vegetarian Capsules</span></span></p>","Taxable Goods","1.00","","","http://www.nutri-health.com/images/products/11601.png","","http://www.nutri-health.com/images/products/thumbs/11601.jpg","13456"
"11706","Nutri-Daily Multivitamin for Men","simple","","No","No","Enabled","Catalog,Search","39.95000","<p><span style=""font-size: medium;""><b><span style=""font-family: verdana,geneva;""><span style=""font-size: small;"">Easy to digest and take every day, new Nutri-Daily goes far beyond a run-of-the-mill multivitamin.<br /></span></span></b></span><span style=","<p><span style=""font-size: medium;""><b><span style=""font-family: verdana,geneva;""><span style=""font-size: small;"">Easy to digest and take every day, new Nutri-Daily goes far beyond a run-of-the-mill multivitamin.<br /></span></span></b></span><span style=""font-size: small;""><span style=""font-family: verdana,geneva;""><span style=""font-size: small;""><br />Packed with 43 carefully selected ""must have"" nutrients, it works four ways to give you comprehensive nutritional support so you can stay healthy, vibrant, and energized at age 50 and beyond.<br /></span></span></span><b><span style=""font-family: verdana,geneva;""><span style=""font-size: small;""><br />You get optimal forms and potencies of nutrients that are likely to decline in your body as you age, including:<br /></span></span></b><span style=""font-size: medium;""><span style=""font-family: verdana,geneva;""><span style=""font-size: small;""><b><br />-&nbsp;&nbsp; Vitamin D</b> in its natural, more effective D3 (cholecalciferol) form.<br /></span></span></span><span style=""font-size: medium;""><span style=""font-family: verdana,geneva;""><span style=""font-size: small;""><b><br />-&nbsp;&nbsp; Vitamin B6 and vitamin B12</b> at higher potencies that you safely take to help reserve hidden deficiencies<br /></span></span></span><span style=""font-size: medium;""><span style=""font-family: verdana,geneva;""><span style=""font-size: small;""><b><br />-&nbsp;&nbsp; Vitamin K2</b>, which is <span style=""text-decoration: underline;"">crucial</span> for promoting bone health. The natural MK-7 form in Nutri-Daily&trade; is as much as <span style=""text-decoration: underline;"">10 times better absorbed!<br /></span></span></span></span><span style=""font-size: medium;""><span style=""font-family: verdana,geneva;""><span style=""font-size: small;""><b><br />-&nbsp;&nbsp; Vitamin C</b>, which provides important support for your heart, eyes, cells, and immune system. Nutri-Daily includes a special form of vitamin C called <i>PureWay&reg; C</i>, which is absorbed more easily<br /></span></span></span><span style=""font-size: medium;""><span style=""font-family: verdana,geneva;""><span style=""font-size: small;""><br />... Plus special forms of <span style=""text-decoration: underline;"">Calcium, Folic Acid, and Vitamin E</span> ... all n the best form for your body to absorb and use ... <span style=""text-decoration: underline;"">even if you have digestive trouble!<br /></span></span></span></span><span style=""font-size: medium;""><span style=""font-family: verdana,geneva;""><span style=""font-size: small;""><b><br />Nutri-Daily for Men </b>gives you a powerful Men's Priority Health Formula to help address concerns about prostate and sexual health as you age. You get Korean red ginseng to support sexual vitality, along with zinc to promote normal testosterone levels. Plus you get lycopene and selenium to maintain prostate function and cellular health.<br /></span></span></span><span style=""font-size: medium;""><span style=""font-family: verdana,geneva;""><span style=""font-size: small;""><br />Nutri-Daily also comes in <span style=""text-decoration: underline;"">smaller-sized tablets</span>, and features a special <span style=""text-decoration: underline;"">EZ-Swallow</span>&trade; <span style=""text-decoration: underline;"">coating</span> so it's pleasant to take every day.<br /><br />Suggested Use: Adults take 4&nbsp;tablets daily, preferably with a meal.<br /><br />120 tablets</span></span></span></p>","Taxable Goods","1.00","","","http://www.nutri-health.com/images/products/11706.png","","http://www.nutri-health.com/images/products/thumbs/11706.jpg","3925"
"11707","Nutri-Daily Multivitamin for Women","simple","","No","No","Enabled","Catalog,Search","39.95000","<p><span style=""font-size: medium;""><b><span style=""font-family: verdana,geneva;""><span style=""font-size: small;"">Easy to digest and take every day, new Nutri-Daily goes far beyond a run-of-the-mill multivitamin.<br /></span></span></b></span><span style=","<p><span style=""font-size: medium;""><b><span style=""font-family: verdana,geneva;""><span style=""font-size: small;"">Easy to digest and take every day, new Nutri-Daily goes far beyond a run-of-the-mill multivitamin.<br /></span></span></b></span><span style=""font-size: small;""><span style=""font-family: verdana,geneva;""><span style=""font-size: small;""><br />Packed with 43 carefully selected ""must have"" nutrients, it works four ways to give you comprehensive nutritional support so you can stay healthy, vibrant, and energized at age 50 and beyond.<br /></span></span></span><b><span style=""font-family: verdana,geneva;""><span style=""font-size: small;""><br />You get optimal forms and potencies of nutrients that are likely to decline in your body as you age, including:<br /></span></span></b><span style=""font-size: medium;""><span style=""font-family: verdana,geneva;""><span style=""font-size: small;""><b><br />-&nbsp;&nbsp; Vitamin D</b> in its natural, more effective D3 (cholecalciferol) form.<br /></span></span></span><span style=""font-size: medium;""><span style=""font-family: verdana,geneva;""><span style=""font-size: small;""><b><br />-&nbsp;&nbsp; Vitamin B6 and vitamin B12</b> at higher potencies that you safely take to help reserve hidden deficiencies<br /></span></span></span><span style=""font-size: medium;""><span style=""font-family: verdana,geneva;""><span style=""font-size: small;""><b><br />-&nbsp;&nbsp; Vitamin K2</b>, which is <span style=""text-decoration: underline;"">crucial</span> for promoting bone health. The natural MK-7 form in Nutri-Daily&trade; is as much as <span style=""text-decoration: underline;"">10 times better absorbed!<br /></span></span></span></span><span style=""font-size: medium;""><span style=""font-family: verdana,geneva;""><span style=""font-size: small;""><b><br />-&nbsp;&nbsp; Vitamin C</b>, which provides important support for your heart, eyes, cells, and immune system. Nutri-Daily includes a special form of vitamin C called <i>PureWay&reg; C</i>, which is absorbed more easily<br /></span></span></span><span style=""font-size: medium;""><span style=""font-family: verdana,geneva;""><span style=""font-size: small;""><br />... Plus special forms of <span style=""text-decoration: underline;"">Calcium, Folic Acid, and Vitamin E</span> ... all n the best form for your body to absorb and use ... <span style=""text-decoration: underline;"">even if you have digestive trouble!<br /></span></span></span></span><span style=""font-size: medium;""><span style=""font-family: verdana,geneva;""><span style=""font-size: small;""><b><br />Nutri-Daily for Women </b>includes a unique<i> Breast Health Formula</i> to help address a top health concern for many women. It includes HMRlignan&trade;, clinically proven to support normal, protective female hormone levels. You also get higher amounts of calcium and vitamin D for strong bones.<br /></span></span></span><span style=""font-size: medium;""><span style=""font-family: verdana,geneva;""><span style=""font-size: small;""><br />Nutri-Daily also comes in <span style=""text-decoration: underline;"">smaller-sized tablets</span>, and features a special <span style=""text-decoration: underline;"">EZ-Swallow</span>&trade; <span style=""text-decoration: underline;"">coating</span> so it's pleasant to take every day.<br /><br />Suggested Use: Adults take 4 tablets daily, preferably with a meal.<br /><br />120 Tablets<br /></span></span></span></p>","Taxable Goods","1.00","","","http://www.nutri-health.com/images/products/11707.png","","http://www.nutri-health.com/images/products/thumbs/11707.jpg","3512"
"10150","pharMAX Nerve Pain Relief Cream","simple","","No","No","Enabled","Catalog,Search","37.90000","<p><meta http-equiv=""Content-Type"" content=""text/html; charset=us-ascii"" /><style type=""text/css""><!--.New1211CatTop	{font-family:Helvetica,Arial,sans-serif;	font-size:15px;	color:#333;	padding-top:25px;	padding-right:15px;	padding-bottom:30px;	padding-le","<p><meta http-equiv=""Content-Type"" content=""text/html; charset=us-ascii"" /><style type=""text/css""><!--.New1211CatTop	{font-family:Helvetica,Arial,sans-serif;	font-size:15px;	color:#333;	padding-top:25px;	padding-right:15px;	padding-bottom:30px;	padding-left:15px;	line-height:17px}.New1211CatTop h1	{background-color:transparent!important;	font-size:20px;	color:#060;	padding-bottom:3px;	border-bottom-width:2px;	border-bottom-style:dotted;	border-bottom-color:#CCC}.New1211CatTop p	{font-family:Helvetica,Arial,sans-serif;	font-size:15px;	line-height:17px;	margin-bottom:20px}.New1211CatTop p a	{color:#645A5A;	font-weight:bold}.New1211CatTop p a:hover	{background-color:#333;	text-decoration:none;	color:#FFF}.NewCatHeadimg	{padding-top:25px;	padding-right:15px;	padding-bottom:5px;	padding-left:15px;	position:relative}.New1211CatTop ul	{margin-top:20px;	margin-left:25px;	padding-left:1em;	list-style-type:square}.New1211CatTop ul li	{margin-bottom:6px}--></style></p><div class=""New1211CatTop""><p style=""font-size:20px""><span style=""font-size: medium;"">Nutri-Health is proud to offer its customers pharMAX nerve. Pharmax is a trusted brand of Seroyal, our sister company under the Atrium Innovations umbrella. Seroyal offers a comprehensive line of professional grade nutraceuticals products built upon a 15 year research-driven scientific foundation.</span><b><span style=""font""><br /></span></b></p><p style=""font-size:20px""><b><span style=""font"">pharMAX<sup>&trade;</sup> nerve</span><br /> Temporary relief for symptoms associated with nerve pain and diabetic nerve pain</b></p><p>Developed by leading Canadian Molecular Pharmacologist, Dr. Joseph Gabriele,  <b>pharMAX nerve</b> homeopathic pain relief cream combines natural oils and extracts that work synergistically for maximum relief for your nerve pain. In  <b>pharMAX nerve</b>, Dr. Gabriele has included:</p><ul><li>Capsicum (Capsicum annuum L.) 2C for soothing relief from muscle aches with vitamin A, vitamin B6, vitamin E, vitamin C, riboflavin, potassium and manganese.</li><li>Rutin for powerful antioxidant support and skin conditioning.</li><li>Acai (Euterpe oleracea) fruit oil, an acclaimed ""superfood"", with omega-3 fatty acids and antioxidants.</li><li>Green tea (Camellia sinensis) leaf extract to help fight free radicals with antioxidant polyphenols, catechins and tannins.</li><li>Lime (Citrus aurantifolia) oil which regulates the calcium channels (nerve channel).</li></ul><p>The natural active ingredients in <b>pharMAX nerve</b>, including rutin and its derivatives, have the potential to inhibit 5   pain pathways that help mediate inflammation.</p><p>The power of   <b>pharMAX nerve</b> comes from delivra&trade; trans-dermal technology, a   proprietary compound base topical delivery system that when combined   with medicinal ingredients delivers it deep into the skin&rsquo;s dermis   layer.</p><p>In subdermal trials the delivra technology was shown to deliver active ingredients more effectively than a leading competitor.  <b>After just one hour, the delivra concentration was 297% higher than the competitor</b>, and  <b>24 hours later it was a whopping 687% higher</b>.</p><p>That means   the active ingredients penetrate deep into your skin, getting to the   areas that need pain relief fast. And, they stay longer, providing more   lasting relief than the competition.</p><p><b>pharMAX</b> nerve utilizes the purest natural actives and contains no strong odors. The non-greasy, non-sticky cream goes   on smooth and is easily aborbed into the skin. Plus, it&rsquo;s free of parabens, sodium lauryl sulfate (SLS), and petrolatum.</p></div>","Taxable Goods","1.00","","","http://www.nutri-health.com/images/products/10150.png","","http://www.nutri-health.com/images/products/thumbs/10150.jpg","42"
