"sku","name","product.type","product.attribute_set","product.has_options","product.required_options","status","visibility","price","short_description","description","tax_class_id","weight","category.path","special_price","image","small_image","thumbnail","stock.qty"
"10501","ArthroZyme Joint & Muscle","simple","","No","No","Enabled","Catalog,Search","39.95000","<p class=""MsoNormal""><span style=""font-size: small;"">ArthroZyme Joint &amp; Muscle doesn't just mask your joint symptoms - it <span style=""text-decoration: underline;"">gets to the source</span> of your trouble, so you <strong>finally get lasting relief fr","<p class=""MsoNormal""><span style=""font-size: small;"">ArthroZyme Joint &amp; Muscle doesn't just mask your joint symptoms - it <span style=""text-decoration: underline;"">gets to the source</span> of your trouble, so you <strong>finally get lasting relief from the everyday aches and stiffness</strong> that prevent you from moving through your day with effortless comfort you once enjoyed.<br /></span><span style=""font-family: verdana,geneva;""><span style=""font-size: small;""><br />ArthroZyme attacks the build-up of <i>fibrin</i>, a form of harmful protein debris that can collect at various points throughout the body - particularly joints. Excess fibrin can harden tissue, which restricts movement and heightens joint inflammation and discomfort.<br /></span></span><span style=""font-family: verdana,geneva;""><span style=""font-size: small;""><br />ArthroZyme Joint &amp; Muscle features one of the most powerful, natural fibrin-busting ingredients available -Serratiopeptidase (or ""SP"" for short). SP is a powerful systemic enzyme first discovered in the silkworm. Now synthesized into a natural supplement form, SP helps <b>break up protein-based fibrin throughout the body</b> so it can be safely ushered away, restoring your body's healthy inflammation response and bringing soothing comfort to your aching joints.<br /></span></span><span style=""font-family: verdana,geneva;""><span style=""font-size: small;""><br />Plus, the SP in ArthroZyme is independently tested for purity and potency; each tablet is enteric coated to resist stomach acid. This helps ArthroZyme travel safely to the small intestine for maximum absorption and effectiveness!<br /></span></span><b><span style=""font-family: verdana,geneva;""><span style=""font-size: small;""><br />What's in ArthroZyme?<br /></span></span></b><span style=""font-family: verdana,geneva;""><span style=""font-size: small;""><br />The product is formulated at the optimum dosage of 10 mg per tablet (20,000 IU) and is enteric coated for maximum effectiveness. Nutri-Health&reg; scientists obtain the purest, </span></span><span style=""font-family: verdana,geneva;""><span style=""font-size: small;"">most effective form of serratiopeptidase available which is independently tested for purity and potency.<br /><br />Suggested Use: Adults take up to 3 tablets daily on an empty stomach. <br /><br />90 Tablets</span></span></p><a rel=""nofollow"" style=""font-size:14px; visibility:hidden; width:0px; height:0px; overflow:hidden""><p style=""height:0px; margin:0px;"">Serratiopeptidase, natural joint relief, natural muscle pain relief, ArthoZyme Plus, joint relief, joint discomfort, knee pain, elbows, hip pain, hips, complete joint solution, Serrapeptase</p></a>","Taxable Goods","1.00","","","http://www.nutri-health.com/images/products/10501.png","","http://www.nutri-health.com/images/products/thumbs/10501.jpg","11571"
"10503","ArthroZyme Plus Joint & Muscle","simple","","No","No","Enabled","Catalog,Search","39.95000","<style type=""text/css""><!--.New1211CatTop	{font-family:Helvetica,Arial,sans-serif;	font-size:15px;	color:#333;	padding-top:25px;	padding-right:15px;	padding-bottom:30px;	padding-left:15px;	line-height:17px}.New1211CatTop h1	{	background-color:transparent!","<style type=""text/css""><!--.New1211CatTop	{font-family:Helvetica,Arial,sans-serif;	font-size:15px;	color:#333;	padding-top:25px;	padding-right:15px;	padding-bottom:30px;	padding-left:15px;	line-height:17px}.New1211CatTop h1	{	background-color:transparent!important;	font-size:26px;	color:#060;	padding-bottom:3px;	border-bottom-width:2px;	border-bottom-style:dotted;	border-bottom-color:#CCC}.New1211CatTop h2 {	font-size: 20px;	margin-top: 15px;	margin-bottom: 25px;}.New1211CatTop p	{	font-family:Helvetica, Arial, sans-serif;	font-size:15px;	line-height:normal;	color:#333;	margin-bottom:25px}.New1211CatTop p a	{color:#645A5A;	font-weight:bold}.New1211CatTop p a:hover	{background-color:#333;	text-decoration:none;	color:#FFF}.NewCatHeadimg	{padding-top:25px;	padding-right:15px;	padding-bottom:5px;	padding-left:15px;	position:relative}.New1211CatTop ul	{margin-top:20px;	margin-left:25px;	padding-left:1em;	color:#333;	list-style-type:square}.New1211CatTop ul li	{margin-bottom:6px}--></style><div class=""New1211CatTop"">  <h1>Nutri-Health <strong>AthroZyme Plus</strong> </h1>  <h2>Get to the Root of Joint and Muscle Pain for Fast Relief  </h2>  <p><strong>ArthroZyme Plus</strong> isn't your &quot;ordinary joint health formula&quot;. This incredibly fast-acting formula will turn down the enzymes that cause pain... shield your cartilage from destruction and target inflammation at its source.  </p>  <h2>How will ArthroZyme Plus benefit your health? </h2>  <p><strong>ArthroZyme Plus</strong> is specifically designed to zero in on the exact causes of pain and neutralize them at the source. Better yet, it doesn't take months to kick into action. The powerful ingredients in <strong>ArthroZyme Plus</strong> start working in a matter of days to: </p>  <ul>    <li>Reduce inflammation and stiffness  </li>    <li>Shut down the enzyme destroying your cartilage </li>    <li>Switch off your pain triggers </li>    <li>Increase flexibility, mobility and healthy joint movement</li>  </ul><h2>Why choose ArthroZyme Plus? </h2><p>What makes <strong>ArthroZyme Plus</strong> so powerful is the scientifically proven ingredients—at research dosages—that work inside your body to quickly reduce factors related to pain.</p><p> In <strong>ArthroZyme Plus</strong> we use a unique form of boswellia called Boxwellia  10X (5-LOXIN) that is a ten-times concentrated form of the most active pain-fighting boswellic acid available. That means it works ten times harder than other boswellia extracts to zero in on two major sources of pain and inflammation. </p><p>In addition, <strong>ArthroZyme Plus</strong> includes: </p><ul>  <li><strong>Serratiopeptidase</strong> to help reduce pain, swelling and inflammation in joints </li>  <li><strong>Bromelain</strong> to minimize inflammation and improve stiffness and mobility </li>  <li><strong>Vitamin D3</strong> to boost your protection against the loss of cartilage </li>  <li><strong>Zinc</strong> for greater muscle comfort and flexibility </li></ul><p>Once you start taking ArthroZyme Plus you'll be surprised at how much easier it will be to join friends for an active night out on the town, spend time playing with the grandkids or get back into your favorite sport. Dance, play, run! It's your life and you CAN live it the way you want. </p>  <p style=""font-size:9px"">* These statements have not been evaluated by the Food and Drug Administration. This product is not intended to diagnose, treat, cure, or prevent any disease.</p></div>","Taxable Goods","1.00","","","http://www.nutri-health.com/images/products/10503.png","","http://www.nutri-health.com/images/products/thumbs/10503.jpg","33590"
"11902","BG-Cor Advanced Heart Health","simple","","No","No","Enabled","Catalog,Search","39.95000","<style type=""text/css""><!--.New1211CatTop	{font-family:Helvetica,Arial,sans-serif;	font-size:15px;	color:#333;	padding-top:25px;	padding-right:15px;	padding-bottom:30px;	padding-left:15px;	line-height:17px}.New1211CatTop h1	{	background-color:transparent!","<style type=""text/css""><!--.New1211CatTop	{font-family:Helvetica,Arial,sans-serif;	font-size:15px;	color:#333;	padding-top:25px;	padding-right:15px;	padding-bottom:30px;	padding-left:15px;	line-height:17px}.New1211CatTop h1	{	background-color:transparent!important;	font-size:26px;	color:#060;	padding-bottom:3px;	border-bottom-width:2px;	border-bottom-style:dotted;	border-bottom-color:#CCC}.New1211CatTop h2 {	font-size: 20px;	margin-top: 15px;	margin-bottom: 25px;}.New1211CatTop p	{	font-family:Helvetica, Arial, sans-serif;	font-size:15px;	line-height:normal;	color:#333;	margin-bottom:25px}.New1211CatTop p a	{color:#645A5A;	font-weight:bold}.New1211CatTop p a:hover	{background-color:#333;	text-decoration:none;	color:#FFF}.NewCatHeadimg	{padding-top:25px;	padding-right:15px;	padding-bottom:5px;	padding-left:15px;	position:relative}.New1211CatTop ul	{	margin-top:20px;	margin-left:25px;	padding-left:1em;	color:#333;	list-style-type:square}.New1211CatTop ul li	{margin-bottom:6px}--></style><div class=""New1211CatTop"">  <h1>Nutri-Health <strong>BG-Cor Advanced Heart Health</strong></h1>  <h2><strong>Promote Normal Cholesterol and Triglyceride Levels </strong> </h2><p><strong>BG-Cor&#8482; Advanced Heart Health</strong> is one of the first supplement formulas to provide &quot;triple barrel,&quot; synergistic support for your heart. Not only have <strong>BG-Cor's</strong> natural ingredients been shown to balance LDL cholesterol levels, the research also indicates they can help increase levels of beneficial HDL cholesterol, and promote healthy triglycerides.</p>  <h2>How will BG-Cor benefit your health?</h2>  <p><strong>BG-Cor</strong> features a highly standardized Bergamot citrus fruit extract, called Bergamonte&reg;, which has been clinically shown to:</p>  <ul>    <li>Lower total and LDL cholesterol levels</li>    <li>Raise &quot;good&quot; HDL cholesterol levels</li>    <li>Support healthy triglyceride levels</li>    <li>Decrease blood sugar levels<br />    </li>  </ul>  <h2><strong>Why choose BG-Cor?</strong>  </h2>  <p><strong>BG-Cor</strong> is one of the first supplement formulas to provide this kind of synergistic support for your heart health. By addressing all these critical issues, <strong>BG-Cor</strong> is a true breakthrough in natural cholesterol formulas. </p>  <p><strong>BG-Cor</strong> gives you the research dose of 500 mg of Bergamonte plus 1.3 g of phytosterols. Research shows that foods or supplements providing at least 500mg of phytosterols eaten along with meals and snacks for a total daily intake of 2g and as part of a diet low in saturated fat and cholesterol may reduce the risk of heart disease. </p>  <p>Even if you don't have a &quot;heart problem,&quot; but a family history has you concerned about your cholesterol, put <strong>BG-Cor</strong> to work for you. <strong>BG-Cor</strong> can help stop the worrying because finally you can do something to lower your numbers now and keep them in the normal range for years to come. </p>  <p style=""font-size:9px"">* These statements have not been evaluated by the Food and Drug Administration. This product is not intended to diagnose, treat, cure, or prevent any disease.</p></div>","Taxable Goods","1.00","","","http://www.nutri-health.com/images/products/11902.png","","http://www.nutri-health.com/images/products/thumbs/11902.jpg","10242"
"11805","Bi-Optium Eye Health","simple","","No","No","Enabled","Catalog,Search","39.95000","<p><span style=""font-family: verdana,geneva;""><span style=""font-size: small;""><strong><span style=""font-size: medium;"">Protect Your Sight for Life-Long Independence<br /></span></strong></span></span><span style=""font-family: verdana,geneva;""><span style=","<p><span style=""font-family: verdana,geneva;""><span style=""font-size: small;""><strong><span style=""font-size: medium;"">Protect Your Sight for Life-Long Independence<br /></span></strong></span></span><span style=""font-family: verdana,geneva;""><span style=""font-size: small;""><strong><br />Bi-Optium: Super Nutrition for Your Eyes<br /></strong></span></span><span style=""font-family: verdana,geneva;""><span style=""font-size: small;""><br />Now there is a natural way to give your eyes all of the support they need. It&rsquo;s called <strong><em>Bi-Optium</em></strong>, a powerhouse blend of 10 &ldquo;must-have&rdquo; nutrients and antioxidants that target your eyes. The carefully selected combination of lutein, zeaxanthin, astaxanthin and powerful mineral chelates work together to promote healthy eye maintenance.<br /></span></span><span style=""font-family: verdana,geneva;""><span style=""font-size: small;""><br />&bull; &nbsp;Relieve your eyes of daily soreness, fatigue and strain<br />&bull;&nbsp; Improve contrast and blurriness<br />&bull;&nbsp; Promote better glare tolerance<br />&bull;&nbsp; Support macular and retinal health<br />&bull;&nbsp; Improve oxygen flow to your eyes and blood vessels<br />&bull;&nbsp; Destroy and dispose of harmful free radicals <br />&bull;&nbsp; Support normal vision and healthy eyes as you age<br /></span></span><span style=""font-family: verdana,geneva;""><span style=""font-size: small;""><strong><br />Lutein and Zeaxanthin: The Dynamic Duo for Clearer Vision<br /></strong></span></span><span style=""font-family: verdana,geneva;""><span style=""font-size: small;""><br />The National Institute of Health is currently conducting a study on two of the key ingredients in <strong><em>Bi-Optium</em></strong>. In the second Age-Related Eye Study of its kind (AREDS2,) researchers are studying the effects of 10 mg. of lutein and 2 mg. of zeaxanthin on eye health. This is the same daily dosage found in 2 <strong><em>Bi-Optium</em></strong> capsules. <br /></span></span><span style=""font-family: verdana,geneva;""><span style=""font-size: small;""><br />These powerful antioxidants are concentrated in the macular pigment of your eyes where they help filter harmful blue light from damaging your cells. By limiting the amount of blue light that enters the eye, lutein and zeaxanthin act like &ldquo;internal sunglasses&rdquo; that protect against free radical damage and keep your eyesight clear and focused.<br /></span></span><span style=""font-family: verdana,geneva;""><span style=""font-size: small;""><br />Additional research shows that lutein and zeaxanthin promote better glare tolerance, reduce visual stress and support your macula. Lutein was also found to improve visual performance in low light conditions.<br /></span></span><span style=""font-family: verdana,geneva;""><span style=""font-size: small;""><strong><br />Astaxanthin: The Emerging Superstar in Eye Support<br /></strong></span></span><span style=""font-family: verdana,geneva;""><span style=""font-size: small;""><br />Astaxanthin is now emerging as another valuable antioxidant that <em>safeguards your eyes from oxidative stress and damage which can result in eye fatigue, straining and blurring</em>. Its unique molecular structure helps it easily enter the cells of the retina where it can do the most good.&nbsp; <br /></span></span><span style=""font-family: verdana,geneva;""><span style=""font-size: small;""><br />In fact, a number of studies have shown that this mighty antioxidant is more than ten times as potent as beta-carotene in scavenging oxygen free radicals.<br /></span></span><span style=""font-family: verdana,geneva;""><span style=""font-size: small;""><strong><br />Targeted Nutrition to Protect Your Eyesight<br /></strong></span></span><span style=""font-family: verdana,geneva;""><span style=""font-size: small;""><br />The antioxidant carotenoids <em>lutein, zeaxanthin and astaxanthin</em> are powerful on their own. But we&rsquo;ve added even more strength to <strong>Bi-Optium&trade; Eye Health</strong>. It contains other eye-healthy nutrients often overlooked in other formulas, including B vitamins, and vitamins C and E. <br /></span></span><span style=""font-family: verdana,geneva;""><span style=""font-size: small;""><br />Together, the eye critical nutrients in <strong><em>Bi-Optium</em></strong> support every part of your eyes and their surrounding &ldquo;support systems.&rdquo; This includes your maculas, retinas, lenses, and blood vessels &mdash; to give you a lifetime of healthy vision.<br /><br />Suggested Use: Adults take 1 capsule with breakfast and 1 capsule with lunch.<br /><br />60 Vegetarian Capsules</span></span></p>","Taxable Goods","1.00","","","http://www.nutri-health.com/images/products/11805.png","","http://www.nutri-health.com/images/products/thumbs/11805.jpg","220"
"11506","D-Ribose GoldM - Muscle & Energy Support","simple","","No","No","Enabled","Catalog,Search","55.95000","<p><span style=""font-family: verdana,geneva;""><span style=""font-size: small;"">D-Ribose GoldM has all the great benefits of regular D-Ribose Gold to restore your body&rsquo;s core energy and keep it fully charged with the </span></span><i><span style=""font","<p><span style=""font-family: verdana,geneva;""><span style=""font-size: small;"">D-Ribose GoldM has all the great benefits of regular D-Ribose Gold to restore your body&rsquo;s core energy and keep it fully charged with the </span></span><i><span style=""font-family: verdana,geneva;""><span style=""font-size: small;"">added muscle relief of magnesium and malate.<br /></span></span></i><b><span style=""font-family: verdana,geneva;""><span style=""font-size: small;""><br />Why </span></span></b><b><span style=""font-family: verdana,geneva;""><span style=""font-size: small;""><span style=""font-size: small;""><b style=""mso-bidi-font-weight: normal;""><span style=""font-family: verdana,geneva;""><span style=""font-size: small;""><span style=""font-family: verdana,geneva;""><span style=""color: #000000;"">D-Ribose GoldM</span></span></span></span></b></span>?<br /></span></span></b><span style=""font-family: verdana,geneva;""><span style=""font-size: small;""><br /><span style=""font-size: x-small;"">*</span>&nbsp;&nbsp; D-Ribose GoldM contains pure RIBOSE to help your cells and tissues <b>make the energy they need to stay healthy</b>.<br /><br /><span style=""font-size: x-small;"">*</span>&nbsp;&nbsp; It also provides magnesium and malate, vital ingredients your body needs to<b> use energy efficiently</b>.<br /><br /><span style=""font-size: x-small;"">*</span>&nbsp;&nbsp; This unique, safe, and clinically proven combination of ingredients </span></span><span style=""font-family: verdana,geneva;""><span style=""font-size: small;""><b>accelerates your body's own natural process of energy synthesis and utilization.<br /><br /></b>Suggested Use: Adults take 2 teaspoons (1 scoop) twice daily, with morning and evening meals, or as directed by a physician. Product may be mixed into a beverage.<br /><br />12 ounces (340g) Powder, 56 servings</span></span></p>","Taxable Goods","1.00","","","http://www.nutri-health.com/images/products/11506.png","","http://www.nutri-health.com/images/products/thumbs/11506.jpg","1200"
"10404","Flora Sinus Seasonal Support","simple","","No","No","Enabled","Catalog,Search","39.95000","<style type=""text/css""><!--.New1211CatTop	{font-family:Helvetica,Arial,sans-serif;	font-size:15px;	color:#333;	padding-top:25px;	padding-right:15px;	padding-bottom:30px;	padding-left:15px;	line-height:17px}.New1211CatTop h1	{	background-color:transparent!","<style type=""text/css""><!--.New1211CatTop	{font-family:Helvetica,Arial,sans-serif;	font-size:15px;	color:#333;	padding-top:25px;	padding-right:15px;	padding-bottom:30px;	padding-left:15px;	line-height:17px}.New1211CatTop h1	{	background-color:transparent!important;	font-size:26px;	color:#060;	padding-bottom:3px;	border-bottom-width:2px;	border-bottom-style:dotted;	border-bottom-color:#CCC}.New1211CatTop h2 {	font-size: 20px;	margin-top: 15px;	margin-bottom: 25px;}.New1211CatTop p	{	font-family:Helvetica, Arial, sans-serif;	font-size:15px;	line-height:normal;	color:#333;	margin-bottom:25px}.New1211CatTop p a	{color:#645A5A;	font-weight:bold}.New1211CatTop p a:hover	{background-color:#333;	text-decoration:none;	color:#FFF}.NewCatHeadimg	{padding-top:25px;	padding-right:15px;	padding-bottom:5px;	padding-left:15px;	position:relative}.New1211CatTop ul	{	margin-top:20px;	margin-left:25px;	padding-left:1em;	color:#333;	list-style-type:square}.New1211CatTop ul li	{margin-bottom:6px}--></style><div class=""New1211CatTop"">  <h1>Nutri-Health <strong>Flora Sinus</strong>  </h1>  <h2><strong>Do you have Nasal  Congestion and Sinus Pressure?</strong>  </h2>  <p>The secret to  breaking down nasal congestion is to support healthy mucus secretion.   This means attacking stubborn sinus problems at their source. The  clinically proven ingredients in <strong>Flora Sinus</strong> do just that by  offering a dual-action solution aimed at stopping nasal irritation,  inflammation and congestion in their tracks.</p>  <h2><strong>How will Flora  Sinus benefit your health?</strong>  </h2>  <p>The combination of  proven ingredients in <strong>Flora Sinus</strong> work in harmony to…  </p>  <ul>    <li>    Relieve nasal  congestion so you can breathe easier</li>    <li>Improve mucus  flow and flush out unhealthy nasal irritants</li>    <li>Ease  head-pounding sinus pressure</li>    <li>Get rid of  hard, dried up mucus that causes inflammation</li>    <li>Reduce  drainage and phlegm in the back of the throat</li>    <li>Boost healthy  flora in sinuses</li>    <li>Promote  healthy immune response  </li>  </ul>  <h2><strong>Why choose Flora  Sinus?</strong>  </h2>  <p><strong>Flora Sinus</strong> includes one of the most potent mucus-busters available—a powerful  antioxidant known as N-Acetyl Cysteine (NAC). This amino acid is  widely recognized as both an immune-booster and a mucus-thinning  agent. In fact, it’s so effective at clearing up your sinuses that  when researchers tested it out, it started working within one hour to  break down nose-clogging mucus. And it was still working four hours  later.  </p>  <p>Once mucus starts  flowing naturally it helps flush out harmful irritants, reduce nasal  congestion and relieve sinus pressure.  </p>  <p><strong>Flora Sinus</strong> also includes four sinus-specific probiotics inspired by  groundbreaking research out of Switzerland. In a landmark 2003 study  Swiss scientists showed these four probiotics—the same ones found  in Flora Sinus—support a healthy balance of friendly bacteria and  in the nose. At the same time, they reduce unhealthy irritants that  can worsen sinus conditions and lower your immune response.  </p>  <p>Don’t suffer  another minute of sinus congestion and pounding pressure. Target the  source of your nasal misery with<strong> Flora Sinus.</strong></p><p style=""font-size:9px"">* These statements have not been evaluated by the Food and Drug Administration. This product is not intended to diagnose, treat, cure, or prevent any disease.</p></div>","Taxable Goods","1.00","","","http://www.nutri-health.com/images/products/10404.png","","http://www.nutri-health.com/images/products/thumbs/10404.jpg","8804"
