"sku","name","product.type","product.attribute_set","product.has_options","product.required_options","status","visibility","price","short_description","description","tax_class_id","weight","category.path","special_price","image","small_image","thumbnail","stock.qty"
"11903","Glucoprotect 6X Blood Sugar Control Supplements","simple","","No","No","Enabled","Catalog,Search","39.95000","<p><span style=""font-family: verdana,geneva;""><span style=""font-size: small;""><span style=""font-size: medium;""><strong>Regain Glucose Control with Today&rsquo;s Most Potent Sugar-Busters</strong>&nbsp;</span><br /><br />Now you can take control of your bl","<p><span style=""font-family: verdana,geneva;""><span style=""font-size: small;""><span style=""font-size: medium;""><strong>Regain Glucose Control with Today&rsquo;s Most Potent Sugar-Busters</strong>&nbsp;</span><br /><br />Now you can take control of your blood glucose numbers with our potent blend of scientifically proven sugar-busters. <strong><em>GlucoProtect 6X</em></strong> is a powerful formula that works with your body to help maintain naturally healthy blood sugar levels and support appropriate insulin response.<br /></span></span><span style=""font-family: verdana,geneva;""><span style=""font-size: small;""><br />One of the key in ingredients in <strong><em>GlucoProtect 6X</em></strong> is an exciting new Swiss discovery that takes blood glucose management to an entirely new level. It&rsquo;s called Portusana&trade;, an extract of Purslane that offers triple-mode protection against sugar highs and crashes. <br /></span></span><span style=""font-family: verdana,geneva;""><span style=""font-size: small;""><br />This amazing extract works so well that, in a groundbreaking pilot study, subjects with the highest levels of blood sugar were able to <strong>DROP SUGAR LEVELS BY NEARLY 70%</strong> in a little over one month! <br /></span></span><span style=""font-family: verdana,geneva;""><span style=""font-size: small;""><br />In a double-blind follow-up study, the results were just as astonishing:<br /></span></span><span style=""font-family: verdana,geneva;""><span style=""font-size: small;""><br />&bull;&nbsp; HbA1c levels improved by almost 80% in patients after just 6 weeks.<br />&bull; &nbsp;Blood sugar returned to normal range in 12 weeks.<br />&bull; &nbsp;And Portusana outperformed the placebo by 44%!<br /></span></span><span style=""font-family: verdana,geneva;""><span style=""font-size: small;""><strong><br />Experience the ENERGY AND FOCUS that comes with Healthy Glucose Metabolism<br /></strong></span></span><span style=""font-family: verdana,geneva;""><span style=""font-size: small;""><br />If your blood sugar is rising and ebbing, your body will react to it. One minute you&rsquo;ll have energy to burn. The next you&rsquo;ll feel tired, unfocused and hazy. The key is to stop these sugar swings before they happen so you can feel strong, alert and energetic all day long. <br /></span></span><span style=""font-family: verdana,geneva;""><span style=""font-size: small;""><br />The impressive ingredients in <strong><em>GlucoProtect 6X</em></strong> support healthy metabolism to help you avoid those sugar highs and lows.<br /></span></span><span style=""font-family: verdana,geneva;""><span style=""font-size: small;""><strong><br />Milk thistle extract</strong> helps your liver release glucose into your bloodstream as needed. When your liver isn&rsquo;t functioning properly it can cause wild fluctuations in your blood sugar levels&hellip; triggering those spikes and crashes that leave you feeling hungry, tired and confused. Healthy liver function is necessary to maintain normal, stable blood sugar levels.<br /></span></span><span style=""font-family: verdana,geneva;""><span style=""font-size: small;""><strong><br />Chromium</strong> helps you absorb energy from foods and stabilizes the level of energy you have throughout the day. In a double-blind, placebo controlled study, participants taking 600 mcg of chromium &ndash; the same amount in <strong><em>GlucoProtect 6X</em></strong> &ndash; showed significant improvements compared to placebo. They had less appetite, fewer cravings for carbohydrates and sweets, and reduced overeating.<br /></span></span><span style=""font-family: verdana,geneva;""><span style=""font-size: small;""><strong><br />Biotin </strong>works hand-in-hand with chromium to reduce HbA1c levels. In one study, 600 mcg of chromium combined with 2 mg of biotin levels helped drop fasting glucose 14 times more than placebo. Additionally, HbA1c was reduced by 60% when compared to placebo.<br /></span></span><span style=""font-family: verdana,geneva;""><span style=""font-size: small;""><strong><br />GlucoPhenol</strong> is a powerful fruit blend filled with antioxidants and polyphenols. This scientifically backed combination of strawberry and cranberry supports stable blood sugar levels and normal metabolic function. <br /></span></span><span style=""font-family: verdana,geneva;""><span style=""font-size: small;""><strong><br />Together, the nutrients in GlucoProtect 6X:<br /></strong></span></span><span style=""font-family: verdana,geneva;""><span style=""font-size: small;""><br />&bull; &nbsp;Help maintain steady, normal blood glucose levels <br />&bull;&nbsp; Support normal hemoglobin A1C levels <br />&bull;&nbsp; Reduce carb cravings and support stable energy, appetite and mood<br />&bull;&nbsp; Protect key cells from excess glucose exposure<br />&bull;&nbsp; Promote healthy insulin response<br /></span></span><span style=""font-family: verdana,geneva;""><span style=""font-size: small;""><br />GlucoProtect 6X&trade; may also positively support cognitive and mood health, hunger and metabolism, and energy.<br /></span></span><span style=""font-size: x-small;""><span style=""font-family: verdana,geneva;""><span style=""font-size: small;""><br />Suggested Use: Adults take&nbsp;3 capsules daily.<br /></span></span></span><span style=""font-family: verdana,geneva;""><span style=""font-size: small;""><span style=""font-size: x-small;""><span style=""font-family: verdana,geneva;""><span style=""font-size: small;""><br />90&nbsp;Capsules</span></span></span></span></span></p><div style=""font-size:14px; visibility:hidden; width:0px; height:0px; overflow:hidden"">  <p>sugar, blood sugar, glucose, portusana, purslane, extract, blood sugar levels, crashes, insulin</p></div>","Taxable Goods","1.00","","","http://www.nutri-health.com/images/products/11903.png","","http://www.nutri-health.com/images/products/thumbs/11903.jpg","7326"
"10311","100% New Zealand Colostrum Capsules","simple","","No","No","Enabled","Catalog,Search","39.95000","<p style=""FONT-FAMILY: ""><span style=""font-family: verdana,geneva;""><span style=""font-size: small;""><strong>Why Colostrum?</strong> <br /><br />Recent studies have supported the beneficial effects of bovine colostrum, which is identical in molecular struc","<p style=""FONT-FAMILY: ""><span style=""font-family: verdana,geneva;""><span style=""font-size: small;""><strong>Why Colostrum?</strong> <br /><br />Recent studies have supported the beneficial effects of bovine colostrum, which is identical in molecular structure to the nutrient-rich colostrum in humans. <br /><br /><span style=""text-decoration: underline;"">Colostrum has been shown to:</span> <br /><br />&bull;&nbsp; Support intestinal health <br />&bull;&nbsp; Promote the body's ability to burn fat and increase muscle <br />&bull;&nbsp; Promote normal, natural healing of injuries <br />&bull;&nbsp; Increase energy levels <br />&bull;&nbsp; Support a healthy immune response <br /><br /><strong>Why New Zealand Colostrum?</strong> <br /><br />Colostrum is ""the first food of life"" and New Zealand colostrum is known for its purity and effectiveness. <br /><br />New Zealand colostrum herds are pasture-fed and are raised without the use of hormones, pesticides or antibiotics. <br /><br />Suggested Use: Adults take 2 capsules twice daily.<br /><br />Advanced Use: Take 4 capsules twice daily, 30-45 minutes before exercise.<br /><br />120 Vegetarian Capsules</span></span></p><a rel=""nofollow""  style=""font-size:14px; visibility:hidden; width:0px; height:0px; overflow:hidden"">  <p style=""font-size:14px; visibility:hidden; width:0px; height:0px; overflow:hidden"">olostrum Clostrum Coostrum Colstrum Colotrum Colosrum Colostum Colostrm Colostru CColostrum Coolostrum Collostrum Coloostrum Colosstrum Colosttrum Colostrrum Colostruum Colostrumm oClostrum Cloostrum Coolstrum Colsotrum Colotsrum Colosrtum Colosturm Colostrmu Cilostrum C9lostrum C0lostrum Cplostrum Cllostrum Cklostrum Cokostrum Cooostrum Copostrum Colistrum Col9strum Col0strum Colpstrum Collstrum Colkstrum Coloatrum Colowtrum Coloetrum Colodtrum Coloxtrum Coloztrum Colosrrum Colos5rum Colos6rum Colosyrum Coloshrum Colosgrum Colosfrum Colosteum Colost4um Colost5um Colosttum Colostgum Colostfum Colostdum Colostrym Colostr7m Colostr8m Colostrim Colostrkm Colostrjm Colostrhm Colostrun Colostruj Colostruk Ciolostrum Coilostrum C9olostrum Co9lostrum C0olostrum Co0lostrum Cpolostrum Coplostrum Clolostrum Collostrum Ckolostrum Coklostrum Coklostrum Colkostrum Coolostrum Coloostrum Coplostrum Colpostrum Coliostrum Coloistrum Col9ostrum Colo9strum Col0ostrum Colo0strum Colpostrum Colopstrum Collostrum Cololstrum Colkostrum Colokstrum Coloastrum Colosatrum Colowstrum Coloswtrum Coloestrum Colosetrum Colodstrum Colosdtrum Coloxstrum Colosxtrum Colozstrum Colosztrum Colosrtrum Colostrrum Colos5trum Colost5rum Colos6trum Colost6rum Colosytrum Colostyrum Coloshtrum Colosthrum Colosgtrum Colostgrum Colosftrum Colostfrum Colosterum Colostreum Colost4rum Colostr4um Colost5rum Colostr5um Colosttrum Colostrtum Colostgrum Colostrgum Colostfrum Colostrfum Colostdrum Colostrdum Colostryum Colostruym Colostr7um Colostru7m Colostr8um Colostru8m Colostrium Colostruim Colostrkum Colostrukm Colostrjum Colostrujm Colostrhum Colostruhm Colostrunm Colostrumn Colostrujm Colostrumj Colostrukm Colostrumk ew Zealand colostrum  Nw Zealand colostrum  Ne Zealand colostrum  New ealand colostrum  New Zaland colostrum  New Zeland colostrum  New Zeaand colostrum  New Zealnd colostrum  New Zealad colostrum  New Zealan colostrum  New Zealand olostrum  New Zealand clostrum  New Zealand coostrum  New Zealand colstrum  New Zealand colotrum  New Zealand colosrum  New Zealand colostum  New Zealand colostrm  New Zealand colostru  NNew Zealand colostrum  Neew Zealand colostrum  Neww Zealand colostrum  New ZZealand colostrum  New Zeealand colostrum  New Zeaaland colostrum  New Zealland colostrum  New Zealaand colostrum  New Zealannd colostrum  New Zealandd colostrum  New Zealand ccolostrum  New Zealand coolostrum  New Zealand collostrum  New Zealand coloostrum  New Zealand colosstrum  New Zealand colosttrum  New Zealand colostrrum  New Zealand colostruum  New Zealand colostrumm  eNw Zealand colostrum  Nwe Zealand colostrum  Ne wZealand colostrum  New eZaland colostrum  New Zaeland colostrum  New Zelaand colostrum  New Zeaalnd colostrum  New Zealnad colostrum  New Zealadn colostrum  New Zealan dcolostrum  New Zealand oclostrum  New Zealand cloostrum  New Zealand coolstrum  New Zealand colsotrum  New Zealand colotsrum  New Zealand colosrtum  New Zealand colosturm  New Zealand colostrmu  New Zealand colostru m NewZealand colostrum  New Zealandcolostrum  New Zealand colostrum Nww Zealand colostrum  N3w Zealand colostrum  N4w Zealand colostrum  Nrw Zealand colostrum  Nfw Zealand colostrum  Ndw Zealand colostrum  Nsw Zealand colostrum  Neq Zealand colostrum  Ne2 Zealand colostrum  Ne3 Zealand colostrum  Nee Zealand colostrum  Ned Zealand colostrum  Nes Zealand colostrum  Nea Zealand colostrum  New Zwaland colostrum  New Z3aland colostrum  New Z4aland colostrum  New Zraland colostrum  New Zfaland colostrum  New Zdaland colostrum  New Zsaland colostrum  New Zeqland colostrum  New Zewland colostrum  New Zesland colostrum  New Zexland colostrum  New Zezland colostrum  New Zeakand colostrum  New Zeaoand colostrum  New Zeapand colostrum  New Zealqnd colostrum  New Zealwnd colostrum  New Zealsnd colostrum  New Zealxnd colostrum  New Zealznd colostrum  New Zealabd colostrum  New Zealahd colostrum  New Zealajd colostrum  New Zealamd colostrum  New Zealans colostrum  New Zealane colostrum  New Zealanr colostrum  New Zealanf colostrum  New Zealanc colostrum  New Zealanx colostrum  New Zealand xolostrum  New Zealand dolostrum  New Zealand folostrum  New Zealand volostrum  New Zealand cilostrum  New Zealand c9lostrum  New Zealand c0lostrum  New Zealand cplostrum  New Zealand cllostrum  New Zealand cklostrum  New Zealand cokostrum  New Zealand cooostrum  New Zealand copostrum  New Zealand colistrum  New Zealand col9strum  New Zealand col0strum  New Zealand colpstrum  New Zealand collstrum  New Zealand colkstrum  New Zealand coloatrum  New Zealand colowtrum  New Zealand coloetrum  New Zealand colodtrum  New Zealand coloxtrum  New Zealand coloztrum  New Zealand colosrrum  New Zealand colos5rum  New Zealand colos6rum  New Zealand colosyrum  New Zealand coloshrum  New Zealand colosgrum  New Zealand colosfrum  New Zealand colosteum  New Zealand colost4um  New Zealand colost5um  New Zealand colosttum  New Zealand colostgum  New Zealand colostfum  New Zealand colostdum  New Zealand colostrym  New Zealand colostr7m  New Zealand colostr8m  New Zealand colostrim  New Zealand colostrkm  New Zealand colostrjm  New Zealand colostrhm  New Zealand colostrun  New Zealand colostruj  New Zealand colostruk  Nwew Zealand colostrum  Neww Zealand colostrum  N3ew Zealand colostrum  Ne3w Zealand colostrum  N4ew Zealand colostrum  Ne4w Zealand colostrum  Nrew Zealand colostrum  Nerw Zealand colostrum  Nfew Zealand colostrum  Nefw Zealand colostrum  Ndew Zealand colostrum  Nedw Zealand colostrum  Nsew Zealand colostrum  Nesw Zealand colostrum  Neqw Zealand colostrum  Newq Zealand colostrum  Ne2w Zealand colostrum  New2 Zealand colostrum  Ne3w Zealand colostrum  New3 Zealand colostrum  Neew Zealand colostrum  Newe Zealand colostrum  Nedw Zealand colostrum  Newd Zealand colostrum  Nesw Zealand colostrum  News Zealand colostrum  Neaw Zealand colostrum  Newa Zealand colostrum  New Zwealand colostrum  New Zewaland colostrum  New Z3ealand colostrum  New Ze3aland colostrum  New Z4ealand colostrum  New Ze4aland colostrum  New Zrealand colostrum  New Zeraland colostrum  New Zfealand colostrum  New Zefaland colostrum  New Zdealand colostrum  New Zedaland colostrum  New Zsealand colostrum  New Zesaland colostrum  New Zeqaland colostrum  New Zeaqland colostrum  New Zewaland colostrum  New Zeawland colostrum  New Zesaland colostrum  New Zeasland colostrum  New Zexaland colostrum  New Zeaxland colostrum  New Zezaland colostrum  New Zeazland colostrum  New Zeakland colostrum  New Zealkand colostrum  New Zeaoland colostrum  New Zealoand colostrum  New Zeapland colostrum  New Zealpand colostrum  New Zealqand colostrum ","Taxable Goods","1.00","","","http://www.nutri-health.com/images/products/10311.png","","http://www.nutri-health.com/images/products/thumbs/10311.jpg","809"
"11802","Advanced Cell Rescue","simple","","No","No","Enabled","Catalog,Search","39.95000","<style type=""text/css""><!--.New1211CatTop	{font-family:Helvetica,Arial,sans-serif;	font-size:15px;	color:#333;	padding-top:25px;	padding-right:15px;	padding-bottom:30px;	padding-left:15px;	line-height:17px}.New1211CatTop h1	{	background-color:transparent!","<style type=""text/css""><!--.New1211CatTop	{font-family:Helvetica,Arial,sans-serif;	font-size:15px;	color:#333;	padding-top:25px;	padding-right:15px;	padding-bottom:30px;	padding-left:15px;	line-height:17px}.New1211CatTop h1	{	background-color:transparent!important;	font-size:26px;	color:#060;	padding-bottom:3px;	border-bottom-width:2px;	border-bottom-style:dotted;	border-bottom-color:#CCC}.New1211CatTop h2 {	font-size: 20px;	margin-top: 15px;	margin-bottom: 25px;}.New1211CatTop p	{	font-family:Helvetica, Arial, sans-serif;	font-size:15px;	line-height:normal;	color:#333;	margin-bottom:25px}.New1211CatTop p a	{color:#645A5A;	font-weight:bold}.New1211CatTop p a:hover	{background-color:#333;	text-decoration:none;	color:#FFF}.NewCatHeadimg	{padding-top:25px;	padding-right:15px;	padding-bottom:5px;	padding-left:15px;	position:relative}.New1211CatTop ul	{margin-top:20px;	margin-left:25px;	padding-left:1em;	color:#333;	list-style-type:square}.New1211CatTop ul li	{margin-bottom:6px}--></style><div class=""New1211CatTop"">  <h1>Nutri-Health <strong>Advanced Cell Rescue</strong> </h1>  <h2>Enjoy a Sharper Mind &amp; More Energy</h2>  <p> As we get older, it's not uncommon to feel a frustrating drop in energy levels. That's because our body's production of its natural &quot;energy factories&quot;&mdash;or mitochondria&mdash;goes way down.  Without mitochondria, our cells have no energy... no power to perform their many tasks. <strong>Advanced Cell Rescue</strong> key ingredient is <strong>PQQ </strong>which gives your body what it needs to make new mitochondria... new &quot;energy factories.&quot; </p>  <h2>How will <strong>Advanced Cell Rescue</strong> benefit your health? </h2>  <p>While each ingredient in <strong>Advanced Cell Rescue</strong> provides extraordinary benefits on their own, it's their combined effect that delivers the real longevity power. When you take <strong>Advanced Cell Rescue</strong> daily you'll have&hellip; </p>  <ul>    <li>Sharper thinking, improved memory, and better focus </li>    <li>More pep in your step and a new zest for living </li>    <li>Smoother, healthier, younger looking skin </li>  </ul>  <h2>Why choose <strong>Advanced Cell Rescue</strong>? </h2>  <p>The key ingredient in <strong>Advanced Cell Rescue</strong> is PQQ (short for pyrroloquinoline quinone), which stimulates the creation of mitochondria.  PQQ is a highly potent antioxidant that protects you against oxidative aging. That means your heart, kidneys, brain, and every cell in your body feels younger. </p>  <p><strong>Advanced Cell Rescue</strong> also helps create your mitochondria's natural bodyguard, the super-antioxidant glutathione, so all your new &quot;energy factories&quot; can run at peak efficiency without interference. </p>  <p>Glutathione is perhaps the most important antioxidant in the world. This powerhouse increases nitric oxide, which supports healthy arteries, blood pressure, and healthy muscle function. It also protects your eyes, your blood glucose balance, your brain and all your 100 trillion cells that make your up body.  </p>  <p>However, glutathione is hardly ever used in supplement formulas because of absorption issues. <strong>Advanced Cell Rescue</strong> solves that problem by using the building blocks of glutathione&mdash;N-Acetyl-Cysteine (NAC) and Glycine&mdash;to help your body rev up production naturally. </p>  <p>Finally, <strong>Advanced Cell Rescue</strong> includes astaxanthin help promote younger-looking skin. </p>  <p style=""font-size:9px"">* These statements have not been evaluated by the Food and Drug Administration. This product is not intended to diagnose, treat, cure, or prevent any disease.</p></div>","Taxable Goods","1.00","","","http://www.nutri-health.com/images/products/11802.png","","http://www.nutri-health.com/images/products/thumbs/11802.jpg","6660"
"11904","Advanced-Q CoQ10 with VESIsorb®","simple","","No","No","Enabled","Catalog,Search","39.95000","<style type=""text/css"">.New1211CatTop {	font-family: Helvetica, Arial, sans-serif;	font-size: 15px;	color: #333;	padding-top: 25px;	padding-right: 15px;	padding-bottom: 30px;	padding-left: 15px;	line-height: 17px;}.New1211CatTop h1 {	background-color:tran","<style type=""text/css"">.New1211CatTop {	font-family: Helvetica, Arial, sans-serif;	font-size: 15px;	color: #333;	padding-top: 25px;	padding-right: 15px;	padding-bottom: 30px;	padding-left: 15px;	line-height: 17px;}.New1211CatTop h1 {	background-color:transparent !important;	font-size: 20px;	color: #060;	padding-bottom: 3px;	border-bottom-width: 2px;	border-bottom-style: dotted;	border-bottom-color: #CCC;}.New1211CatTop p {	font-family: Helvetica, Arial, sans-serif;	font-size: 15px;	line-height: 17px;	margin-bottom: 20px;}.New1211CatTop p a {	color: #645A5A;	font-weight: bold;}.New1211CatTop p a:hover {	background-color: #333;	text-decoration: none;	color: #FFF;}.NewCatHeadimg {	padding-top: 25px;	padding-right: 15px;	padding-bottom: 5px;	padding-left: 15px;	position:relative;}.New1211CatTop ul {	margin-top: 20px;	margin-left: 25px;	padding-left: 1em;	list-style-type: square;}.New1211CatTop ul li {	margin-bottom: 6px;}</style><!-- TOP AREA --><div class=""New1211CatTop"">  <p style=""font-size:20px;""><strong>Advanced-Q CoQ10 with VESIsorb<sup>®</sup></strong></p>  <p>Brings you an advanced form of Coenzyme Q10 (<strong>Ubiquinol</strong>) in a patented delivery technology for enhanced absorption for energy and cardiovascular support.</p>  <p>New Advanced-Q is an exciting breakthrough in CoQ10 supplements, because it uses a state-of-the-art delivery system to overcome this problem and maximize your CoQ10 absorption. This helps more CoQ10 get to where it&rsquo;s needed – the vital cells in your heart, brain, eyes, liver, and nearly every important system throughout your body.</p>  <p>In fact, Advanced-Q was found to be six times more absorbable than other standard CoQ10 (unbiquinone) preparations.</p>  <p>Patented VESIsorb® technology turns large CoQ10 molecules into easily absorbed &quot;nanoparticles.&quot; The VESIsorb process works by breaking down the Ubiquinol in Advanced-Q to extremely tiny particles, which are suspended in liquid. These &ldquo;nanoparticles&rdquo; are small enough to pass through your small intestine and into your bloodstream at a much higher rate than most traditional CoQ10 preparations, so you absorb and use more. Plus, Advanced-Q comes in an innovative two-piece Caplique®, which features an airtight band that seals the capsule and shields the CoQ10 inside from oxidative damage.</p>  <p>As we age, we make less CoQ10 and it becomes harder for our bodies to naturally convert the basic ubiquinone form to ubiquinol, which research suggests is so important for combating oxidative stress. Advanced-Q contains CoQ10 in the <strong>Ubiquinol </strong>form, which provides superior support for a healthy heart, brain, nervous system, liver, and blood sugar balance. Plus, Ubiquinol CoQ10 is the best &ldquo;spark plug&rdquo; for helping our bodies make energy at the cellular level – for a difference you can actually feel!</p>  <p>Advanced-Q is the best way to get every bit of benefit from your CoQ10 supplement – for energy you&rsquo;ll feel today, and head-to-toe protection you&rsquo;ll be thankful for tomorrow.</p><p><span style=""font-size:11px"">Suggested Use: Adults take 1 Caplique®* daily, preferably with a meal.</span></p><p><span style=""font-size:11px""> 30 Caplique Capsules </span></p><p><span style=""font-size:11px"">* A Caplique® is a liquid-filled, 2 piece capsule sealed with a band.</span><span style=""font-size:11px""></span></p></div>","Taxable Goods","1.00","","","http://www.nutri-health.com/images/products/11904.png","","http://www.nutri-health.com/images/products/thumbs/11904.jpg","6"
